id,id2,unusual_flag,worst_flag,date,decade,year,month,first_flight,type,make,model,nature,departure_airport,departure_airport_formatted,departure_airport_lat,departure_airport_lng,departure,destination_airport,destination_airport_formatted,destination_airport_lat,destination_airport_lng,destination_country,accident_country,location_full,phase_old,phase,phase_code,passengers_text,crew_text,total_text,passengers_occupants,crew_occupants,total_occupants,passengers_fatalities,crew_fatalities,total_fatalities,total_survivors,ground_casualties,total_occupants_old,passengers_occupants_old,airplane_damage,date_text,registration,operator,narrative
15673,15677,0,23,6/1/2009,2000,2009,6,2005-02-25 (4 years 3 months),Airbus A330-203,Airbus,A330-203,International Scheduled Passenger,"Rio de Janeiro-Gale??o International Airport, RJ (GIG/SBGL), Brazil","RIOgaleão - Tom Jobim International Airport (GIG) - Av. Vinte de Janeiro, s/nº - Ilha do Governador, Rio de Janeiro - RJ, 21941-900, Brazil",-22.8134098,-43.2494233,Brazil,"Paris-Charles de Gaulle Airport (CDG/LFPG), France","Charles de Gaulle Airport (CDG), 95700 Roissy-en-France, France",49.0096906,2.5479245,France,Atlantic Ocean,c 160km NNW off S??o Pedro and S??o Paulo Archipelago (Atlantic Ocean),En route (ENR),En route ,ENR,Fatalities: 216 / Occupants: 216,Fatalities: 12 / Occupants: 12,Fatalities: 228 / Occupants: 228,216,12,228,216,12,228,0,0,,216,Destroyed,Monday 1 June 2009,F-GZCP,Air France,"An Air France Airbus A330-200 was destroyed when it crashed into the sea while on transatlantic flight from Rio de Janeiro-Galeao International Airport, RJ (GIG) to Paris-Charles de Gaulle Airport (CDG).The airplane carried 12 crew members an 216 passengers. Flight AF447 departed at 19:29 local time (May 31) from Rio de Janeiro (GIG). The takeoff weight was 232.8t (for a MTOW of 233 t), including 70.4 tonnes of fuel. The captain was PNF, one of the co-pilots was Pilot Flying (PF).The flight progressed as planned with the crew contacting several air traffic control centres along the way. Cruising altitude was FL350.At 23:35 local time (01:35 UTC), the crew informed the Atlantic Area Control Centre (CINDACTA III) controller that they had passed the INTOL waypoint. INTOL is an RNAV waypoint located in the Atlantic Ocean, 565 km from Natal, Brazil. At 01:48 UTC the aircraft went out of the radar coverage of CINDACTA III, Fernando de Noronha. The meteorological situation in the area of AF447's flight path over the Atlantic was typical of that encountered in the month of June in the inter-tropical convergence zone. There were powerful cumulonimbus clusters on the route of AF447. Some of them could have been the centre of some notable turbulence.At 01:55, the captain woke the second co-pilot and said ""[...] he???s going to take my place"". The captain then attended the briefing between the two co-pilots, during which the Pilot Flying said, in particular ""the little bit of turbulence that you just saw [...] we should find the same ahead [...] we???re in the cloud layer unfortunately we can???t climb much for the moment because the temperature is falling more slowly than forecast"" and that ""the logon with Dakar failed"". The captain left the cockpit at 02:01:46 UTC.The airplane was flying at FL350 and at Mach 0.82 and the pitch attitude was about 2.5 degrees. Autopilot 2 and auto-thrust were engaged. At 02:06:04, the PF called the cabin crew, telling them that ""in two minutes we should enter an area where it???ll move about a bit more than at the moment, you should watch out"" and he added ""I???ll call you back as soon as we???re out of it"".At 02:08:07, the PNF said ""you can maybe go a little to the left [...]"". The airplane began a slight turn to the left, the change in relation to the initial route being about 12 degrees. The level of turbulence increased slightly and the crew decided to reduce the speed to about Mach 0.8.From 02:10:05, the autopilot then auto-thrust disengaged and the PF said ""I have the controls"". The airplane began to roll to the right and the PF made a left nose-up input. The stall warning sounded twice in a row. The recorded parameters show a sharp fall from about 275 kt to 60 kt in the speed displayed on the left primary flight display (PFD), then a few moments later in the speed displayed on the integrated standby instrument system (ISIS). At 02:10:16, the PNF said ""so, we???ve lost the speeds"" then ""alternate law [...]"". The airplane???s pitch attitude increased progressively beyond 10 degrees and the plane started to climb. The PF made nose-down control inputs and alternately left and right roll inputs. The vertical speed, which had reached 7,000 ft/min, dropped to 700 ft/min and the roll varied between 12 degrees right and 10 degrees left. The speed displayed on the left side increased sharply to 215 kt (Mach 0.68). The airplane was then at an altitude of about 37,500 ft and the recorded angle of attack was around 4 degrees. From 02:10:50, the PNF tried several times to call the captain back. At 02:10:51, the stall warning was triggered again. The thrust levers were positioned in the TO/GA detent and the PF maintained nose-up inputs. The recorded angle of attack, of around 6 degrees at the triggering of the stall warning, continued to increase. The trimmable horizontal stabilizer (THS) passed from 3 to 13 degrees nose-up in about 1 minute and remained in the latter position until the end of the flight.Around fifteen seconds later, the speed displayed on the ISIS increased sharply towards 185 kt; it was then consistent with the other recorded speed. The PF continued to make nose-up inputs. The airplane???s altitude reached its maximum of about 38,000 ft, its pitch attitude and angle of attack being 16 degrees.At around 02:11:40, the captain re-entered the cockpit. During the following seconds, all of the recorded speeds became invalid and the stall warning stopped. The altitude was then about 35,000 ft, the angle of attack exceeded 40 degrees and the vertical speed was about -10,000 ft/min. The airplane???s pitch attitude did not exceed 15 degrees and the engines' N1's were close to 100%. The airplane was subject to roll oscillations that sometimes reached 40 degrees. The PF made an input on the sidestick to the left and nose-up stops, which lasted about 30 seconds.At 02:12:02, the PF said ""I don???t have any more indications"", and the PNF said ""we have no valid indications"". At that moment, the thrust levers were in the IDLE detent and the engines' N1's were at 55%. Around fifteen seconds later, the PF made pitch-down inputs. In the following moments, the angle of attack decreased, the speeds became valid again and the stall warning sounded again.At 02:13:32, the PF said ""we???re going to arrive at level one hundred"". About fifteen seconds later, simultaneous inputs by both pilots on the sidesticks were recorded and the PF said ""go ahead you have the controls"". The angle of attack, when it was valid, always remained above 35 degrees. The recordings stopped at 02:14:28. The last recorded values were a vertical speed of -10,912 ft/min, a ground speed of 107 kt, pitch attitude of 16.2 degrees nose-up, roll angle of 5.3 degrees left and a magnetic heading of 270 degrees. The airplane struck the surface of the sea.Several attempts were made to locate the wreckage of the airplane. Finally on April 3, 2011, a search vessel using unmanned subarmines located pieces of wreckage including an engine, landing gear and fuselage and wing parts on the Ocean floor."
13377,13376,0,22,8/6/1997,1990,1997,6,1984-12-03 (12 years 8 months),Boeing 747-3B5,Boeing,747-3B3,International Scheduled Passenger,"Seoul-Gimpo (Kimpo) International Airport (SEL/RKSS), South Korea","Gimpo International Airport (GMP), 112 Haneul-gil, Gangseo-gu, Seoul, South Korea",37.5586545,126.7944739,South Korea,"Guam-A.B. Won Pat International Airport (GUM/PGUM), Guam","Antonio B. Won Pat International Airport (GUM), 355 Chalan Pasaheru B224-A, Tamuning, 96913, Guam",13.4852976,144.8008119,Ukraine,Guam,"4,8 km (3 mls) SW of Guam-Agana International Airport (GUM) (Guam)",Approach (APR),Approach ,APR,Fatalities: 206 / Occupants: 231,Fatalities: 22 / Occupants: 23,Fatalities: 228 / Occupants: 254,231,23,254,206,22,228,26,0,,231,Destroyed,Wednesday 6 August 1997,HL7468,Korean Air,"Korean Air Flight 801 was a regular flight from Seoul to Guam. The Boeing 747-300 departed the gate about 21:27 and was airborne about 21:53. The captain was pilot-flying.Upon arrival to the Guam area, the first officer made initial contact with the Guam Combined Center/Radar Approach Control (CERAP) controller about 01:03, when the airplane was level at 41,000 feet and about 240 nm northwest of the NIMITZ VOR/DME. The CERAP controller told flight 801 to expect to land on runway 06L. About 01:10, the controller instructed flight 801 to ""...descend at your discretion maintain two thousand six hundred."" The first officer responded, ""...descend two thousand six hundred pilot discretion.""The captain then began briefing the first officer and the flight engineer about the approach and landing at Guam: ""I will give you a short briefing...ILS is one one zero three...NIMITZ VOR is one one five three, the course zero six three, since the visibility is six, when we are in the visual approach, as I said before, set the VOR on number two and maintain the VOR for the TOD [top of descent], I will add three miles from the VOR, and start descent when we're about one hundred fifty five miles out. I will add some more speed above the target speed. Well, everything else is all right. In case of go-around, since it is VFR, while staying visual and turning to the right...request a radar vector...if not, we have to go to FLAKE...since the localizer glideslope is out, MDA is five hundred sixty feet and HAT [height above touchdown] is three hundred four feet....""About 01:13 the captain said, ""we better start descent;"" shortly thereafter, the first officer advised the controller that flight 801 was ""leaving four one zero for two thousand six hundred."" During the descent it appeared that the weather at Guam was worsening. At 01:24 requested a deviation 10 miles to the left to avoid severe weather.At 01:31 the first officer reported to the CERAP controller that the airplane was clear of cumulonimbus clouds and requested ""radar vectors for runway six left."" The controller instructed the flight crew to fly a heading of 120??. After this transmission, the flight crew performed the approach checklist and verified the radio frequency for the ILS to runway 06L.About 01:38 the CERAP controller instructed flight 801 to ""...turn left heading zero nine zero join localizer;"" the first officer acknowledged this transmission. At that time, flight 801 was descending through 2,800 feet msl with the flaps extended 10?? and the landing gear up. One minute later the controller stated, ""Korean Air eight zero one cleared for ILS runway six left approach...glideslope unusable."" The first officer responded, ""Korean eight zero one roger...cleared ILS runway six left;"" his response did not acknowledge that the glideslope was unusable. The flight engineer asked, ""is the glideslope working? glideslope? yeh?"" One second later, the captain responded, ""yes, yes, it's working."" About 01:40, an unidentified voice in the cockpit stated, ""check the glideslope if working?"" This statement was followed 1 second later by an unidentified voice in the cockpit asking, ""why is it working?"" The first officer responded, ""not useable."" The altitude alert system chime sounded and the airplane began to descend from an altitude of 2,640 feet msl at a point approximately 9 nm from the runway 06L threshold. About 01:40:22, an unidentified voice in the cockpit said, ""glideslope is incorrect."" As the airplane was descending through 2,400 feet msl, the first officer stated, ""approaching fourteen hundred."" About 4 seconds later, when the airplane was about 8 nm from the runway 06L threshold, the captain stated, ""since today's glideslope condition is not good, we need to maintain one thousand four hundred forty. please set it."" An unidentified voice in the cockpit then responded, ""yes."" About 01:40:42, the CERAP controller instructed flight 801 to contact the Agana control tower. The first officer contacted the Agana tower: ""Korean air eight zero one intercept the localizer six left."" The airplane was descending below 2,000 feet msl at a point 6.8 nm from the runway threshold (3.5 nm from the VOR). About 01:41:01, the Agana tower controller cleared flight 801 to land. About 01:41:14, as the airplane was descending through 1,800 feet msl, the first officer acknowledged the landing clearance, and the captain requested 30?? of flaps.The first officer called for the landing checklist and at 01:41:33, the captain said, ""look carefully"" and ""set five hundred sixty feet"" (the published MDA). The first officer replied ""set,"" the captain called for the landing checklist, and the flight engineer began reading the landing checklist. About 01:41:42, as the airplane descended through 1,400 feet msl, the ground proximity warning system (GPWS) sounded with the radio altitude callout ""one thousand [feet]."" One second later, the captain stated, ""no flags gear and flaps,"" to which the flight engineer responded, ""no flags gear and flaps."" About 01:41:46, the captain asked, ""isn't glideslope working?"" The captain then stated, ""wiper on."" About 01:41:53, the first officer again called for the landing checklist, and the flight engineer resumed reading the checklist items. About 01:41:59, when the airplane was descending through 1,100 feet msl at a point about 4.6 nm from the runway 06L threshold (approximately 1.3 nm from the VOR), the first officer stated ""not in sight?"" One second later, the GPWS radio altitude callout sounded: ""five hundred [feet]."" About 01:42:14, as the airplane was descending through 840 feet msl and the flight crew was performing the landing checklist, the GPWS issued a ""minimums minimums"" annunciation followed by a ""sink rate"" alert about 3 seconds later. The first officer responded, ""sink rate okay"". At that time the airplane was descending 1,400 feet per minute.About 01:42:19, as the airplane descended through 730 feet msl, the flight engineer stated, ""two hundred [feet],"" and the first officer said, ""let's make a missed approach."" About one second later, the flight engineer stated, ""not in sight,"" and the first officer said, ""not in sight, missed approach."" About 01:42:22, as the airplane descended through approximately 680 feet msl, the nose began to pitch up and the flight engineer stated, ""go around."" When the captain stated ""go around"" power was added and airspeed began to increase. As the airplane descended through 670 feet msl, the autopilot disconnect warning sounded. The GPWS radio altitude callouts continued: ""one hundred...fifty...forty...thirty...twenty [feet]."" About 01:42:26, the airplane impacted hilly terrain at Nimitz Hill, Guam, about 660 feet msl and about 3.3 nm from the runway 06L -threshold. It struck trees and slid through dense vegetation before coming to rest. A post-impact fire broke out.It was established a.o. that the software fix for the Minimum Safe Altitude Warning (MSAW) system at Agana Center Radar Approach Control (CERAP) had rendered the program useless. A software patch had been installed since there had been complaints of the high rate of false MSAW alarms at Guam. This made KAL801's descent below MDA go undetected at the Agana CERAP."
13595,13595,0,21,9/2/1998,1990,1998,6,1991,McDonnell Douglas MD-11,McDonnell Douglas,C-17A Globemaster III,International Scheduled Passenger,"New York-John F. Kennedy International Airport, NY (JFK/KJFK), United States of America","John F. Kennedy International Airport (JFK), Queens, NY 11430, USA",40.6413111,-73.77813909999999,United States of America,"Gen??ve-Cointrin Airport (GVA/LSGG), Switzerland","Genève Aéroport (GVA), Route de l'Aéroport 21, 1215 Le Grand-Saconnex, Switzerland",46.23700969999999,6.1091564,Switzerland,Canada,"9 km (5.6 mls) SW off Peggy???s Cove, NS (Canada)",En route (ENR),En route ,ENR,Fatalities: 215 / Occupants: 215,Fatalities: 14 / Occupants: 14,Fatalities: 229 / Occupants: 229,215,14,229,215,14,229,0,0,,215,Destroyed,Wednesday 2 September 1998,HB-IWF,Swissair,"At 20:18 Swissair flight SR 111, departed New York-JFK Airport on a flight to Geneva, Switzerland. Forty minutes later the copilot contacted Moncton ACC, reporting FL330. At 21:10 the pilots detected an unusual odour in the cockpit and began to investigate. They determined that some smoke was present in the cockpit, but not in the passenger cabin. They assessed that the odour and smoke were related to the air conditioning system. Four minutes later a Pan Pan radio call was made to Moncton ACC. The aircraft was about 66 nm southwest of Halifax. The pilots reported that there was smoke in the cockpit and requested an immediate return to a convenient place. The pilots named Boston, which was about 300 nm behind them. The Moncton ACC controller immediately cleared SR 111 to turn right toward Boston and to descend to FL310. Then the controller asked SR 111 whether they preferred to go to Halifax. The pilots expressed a preference for Halifax. They immediately received an ATS clearance to fly directly to Halifax. At this time, the pilots donned their oxygen masks. At 21:16, the controller cleared SR 111 to descend to 10000 feet. Two minutes later they were cleared down to 3000 feet. At 21:19, the controller instructed SR 111 to turn left to a heading of 030 for a landing on runway 06 at the Halifax, and advised that the aircraft was 30 nm from the runway threshold. The aircraft was descending through approximately FL210 and the pilots indicated that they needed more than 30 nm. The controller instructed SR 111 to turn to a heading of 360 to provide more track distance for the aircraft to lose altitude. The flight crew discussed internally the dumping of fuel based on the aircraft's gross weight, and on their perception of the cues regarding the aircraft condition, and agreed to dump fuel. The flight was vectored to the south to dump fuel. At 21:24, both pilots almost simultaneously declared an emergency. The co-pilot indicated to the controller that they were starting to dump fuel and that they had to land immediately. Last radio contact was one minute later when they again declared an emergency. By now the fire had propagated, causing severe disturbances of the electric system. In the last minutes of the flight, the electronic navigation equipment and communications radios stopped operating. The aircraft descended over the dark waters off the coast of Nova Scotia until it stuck the water in a 20 degrees nose down and 110 degrees right bank."
13167,13167,0,20,7/17/1996,1990,1996,6,1971-08-18 (24 years 11 months),Boeing 747-131,Boeing,747-122,International Scheduled Passenger,"New York-John F. Kennedy International Airport, NY (JFK/KJFK), United States of America","John F. Kennedy International Airport (JFK), Queens, NY 11430, USA",40.6413111,-73.77813909999999,United States of America,"Paris-Charles de Gaulle Airport (CDG/LFPG), France","Charles de Gaulle Airport (CDG), 95700 Roissy-en-France, France",49.0096906,2.5479245,France,United States of America,"13 km (8.1 mls) S off East Moriches, NY (United States of America)",En route (ENR),En route ,ENR,Fatalities: 212 / Occupants: 212,Fatalities: 18 / Occupants: 18,Fatalities: 230 / Occupants: 230,212,18,230,212,18,230,0,0,,212,Destroyed,Wednesday 17 July 1996,N93119,Trans World Airlines - TWA,"TWA Boeing 747 N93119 arrived as Flight TW881 from Athens at New York-JFK at 16:31. The airplane was refueled at JFK and remained at gate 27 with the auxiliary power unit (APU) and two of its three air conditioning packs operating for about 2 1/2 hours until it departed as TWA flight 800. The flight was scheduled to depart JFK for Paris about 19:00; however, the flight was delayed because of a disabled piece of ground equipment and concerns about a suspected passenger/baggage mismatch. The aircraft was pushed back from the gate about 20:02. Between 20:05 and 20:07, the flight crew started the Nos. 1, 2, and 4 engines and completed the after-start checklist. The flight crew then received taxi instructions and began to taxi to runway 22R. While the airplane was taxiing, about 20:14, the flight crew started the No. 3 engine and conducted the delayed engine-start and taxi checklists.At 20:18:21, ATC advised the pilots that the wind was out of 240-degrees at 8 knots and cleared flight 800 for takeoff. After takeoff the pilots received a series of altitude assignments and heading changes from New York Terminal Radar Approach Control and Boston ARTCC controllers. At 20:25:41, Boston ARTCC advised the pilots to climb and maintain FL190 and expedite through FL150.At 20:26:24, Boston ARTCC amended TWA flight 800's altitude clearance, advising the pilots to maintain FL130. At 20:29:15, the captain stated, ""Look at that crazy fuel flow indicator there on number four .. see that?"" One minute later Boston ARTCC advised them to climb and maintain FL150. The crew then selected climb thrust. After a every loud sound for a fraction of a second, the CVR stopped recording at 20:31:12. At that moment, the crew of an Eastwind Airlines Boeing 737 flying nearby reported seeing an explosion. The aircraft broke up and debris fell into the sea, 8 miles south off East Moriches."
13404,13404,0,19,9/26/1997,1990,1997,6,1982-10-06 (14 years 12 months),Airbus A300B4-220,Airbus,A300B4-203F,Domestic Scheduled Passenger,"Jakarta-Soekarno-Hatta International Airport (CGK/WIII), Indonesia","Soekarno-Hatta International Airport (CGK), Kota Tangerang, Banten 19120, Indonesia",-6.1275118,106.6536859,Indonesia,"Medan-Polonia Airport (MES/WIMM), Indonesia","Polonia International Airport, Jl. Imam Bonjol, Suka Damai, Medan Polonia, Kota Medan, Sumatera Utara 20157, Indonesia",3.5633018,98.6764964,Indonesia,Indonesia,32 km (20 mls) S of Medan-Polonia Airport (MES) (Indonesia),Approach (APR),Approach ,APR,Fatalities: 222 / Occupants: 222,Fatalities: 12 / Occupants: 12,Fatalities: 234 / Occupants: 234,222,12,234,222,12,234,0,0,,222,Destroyed,Friday 26 September 1997,PK-GAI,Garuda Indonesia Airways,"Flight GA152 (Jakarta-Medan) was cleared for an ILS approach to Medan runway 05 and was flying on a 316deg heading on Airway 585/W12. Having descended to 3000 feet the crew were instructed to turn left heading 240deg for vectoring to intercept the runway 05 ILS. At 13:28 the flight was instructed to continue on a 215deg heading and descend to 2000 feet. At 13:30 ATC directed the flight to turn right heading 046 and report when establishing the localizer. Confusion on the part of the air traffic controller followed over whether GA152 was turning left or right. Just 10 seconds after confirming the right turn, the Airbus crashed in a wooded area, broke up and burst into flames. The wreckage covered a 150x75m area near the village of Pancur Batu, which is located at 900-1000m amsl. The region was affected by smog from forest fires; visibility was reported to be 600-800m."
13075,13074,0,18,1/8/1996,1990,1996,6,1988,Antonov 32B,Antonov,32B,Cargo,"Kinshasa-N'Dolo Airport (NLO/FZAB), Congo (Democratic Republic)","Aeroport de Ndolo (NLO), Avenue Del'Aerodrome, Kinshasa, Democratic Republic of the Congo",-4.327222,15.325833,Congo (Democratic Republic),"Kahemba Airport (FZCF), Congo (Democratic Republic)",null,null,null,Democratic Repuglic of Congo,Democratic Republic Congo,Kinshasa-N'Dolo Airport (NLO) (Congo (Democratic Republic)),Initial climb (ICL),Initial climb ,ICL,Fatalities: 0 / Occupants: 0,Fatalities: 0 / Occupants: 6,Fatalities: 0 / Occupants: 6,0,6,6,0,0,0,6,237,,0,Damaged beyond repair,Monday 8 January 1996,RA-26222,0,"The An-32 freighter plane couldn't gain height after take-off from Kinshasa-N'Dolo Airport. The crew elected to abort the take-off, but the aircraft overran the runway by 600m and crashed into a market square. Unconfirmed reports say the aircraft was overloaded by 595 pounds.The aircraft was owned by Moscow Airways and was also flown by a Russian crew. African Air wasn't authorized to operate this flight, and has therefore borrowed authorization papers from Scibe Airlift."
