id	id2	unusual_flag	worst_flag	decade	year	month	make	nature	accident_country	phase_old	phase	phase_code	crew_text	passengers_occupants	crew_occupants	total_occupants	passengers_fatalities	crew_fatalities	total_fatalities	total_survivors	ground_casualties	passengers_occupants_old	airplane_damage	make	nature	accident_country	phase_old	phase	phase_code	crew_text	airplane_damage	Selected	date	cnmsn	first_flight	type	model	status	departure_airport	departure	departure_airport_formatted	departure_lat	departure_lng	destination_airport	destination_country	destination_airport_formatted	destination_lat	destination_lng	location_full	passengers_text	total_text	date_text	registration	operator	narrative
11827.0	11826.0	0.0	40.0	1980.0	1989.0	6.0								156.0	14.0	170.0	156.0	14.0	170.0	0.0	0.0	156.0		MBB	International Scheduled Passenger	Niger	En route (ENR)	En route	ENR	Fatalities: 14 / Occupants: 14	Destroyed	No	9/19/1989	46852/125	1973	McDonnell Douglas DC-10-30	HFB-320 Hansa Jet	Final	N'Djamena Airport (NDJ/FTTJ), Chad	Chad	N'Djamena International Airport, N'Djamena, Chad	12.1293763	15.033964	Paris-Charles de Gaulle Airport (CDG/LFPG), France	France	Charles de Gaulle Airport (CDG), 95700 Roissy-en-France, France	49.0096906	2.5479245	T??n??r?? desert (Niger)	Fatalities: 156 / Occupants: 156	Fatalities: 170 / Occupants: 170	Tuesday 19 September 1989	N54629	Union de Transportes A??riens - UTA	The DC-10 was operating as UTA Flight 772 on the Brazzaville-N'Djamena-Paris route. The aircraft took off from N'Djamena at 13:13 and climbed to a cruising altitude of FL350. At 13:59 an explosion on board caused the aircraft to crash into the desert. The explosive device was located at location 13R in the cargo hold. The device was most probably hidden in baggage, placed aboard at Brazzaville. Possible groups responsible for the explosion are the Islamic Jihad group (demanding the freedom of a Shi'ite Muslim in Israel) or the Secret Chadian Resistance. Co-incidental on March 10, 1984 another UTA aircraft was destroyed when a bomb exploded; in this case the bomb exploded during embarkation at N'Djamena.
11857.0	11855.0	0.0	87.0	1980.0	1989.0	6.0								138.0	8.0	146.0	127.0	4.0	131.0	15.0	0.0	138.0		Boeing	International Scheduled Passenger	Honduras	Approach (APR)	Approach	APR	Fatalities: 4 / Occupants: 8	Destroyed	No	10/21/1989	19514/597	1968-06-21 (21 years 4 months)	Boeing 727-224	727-224	Preliminary - official	Managua-Augusto C Sandino Airport (MGA/MNMG), Nicaragua	Nicaragua	Augusto Cesar Sandino International Airport (MGA), Km. 11 Carretera Norte, Managua, Nicaragua	12.1446517	-86.1713168	Tegucigalpa-Toncontin Airport (TGU/MHTG), Honduras	Honduras	Toncontín International Airport (TGU), restaurante boca del mar, Tegucigalpa, Honduras	14.060701	-87.2178198	9 km (5.6 mls) S of Tegucigalpa-Toncontin Airport (TGU) (Honduras)	Fatalities: 127 / Occupants: 138	Fatalities: 131 / Occupants: 146	Saturday 21 October 1989	N88705	0	TAN-SAHSA flight 414, a Boeing 727-200 was a scheduled flight from San Jos?? (SJO), Costa Rica to Tegucigalpa (TGU), Honduras with an intermediate stop at Managua (MGA), Nicaragua.At the end of the final leg of the flight, the crew were cleared by Tegucigalpa ATC for the VOR/DME runway 01 approach, which includes a series of three step-downs from the initial approach fix altitude of 7500 ft MSL to avoid high terrain in the neighborhood of the airport. Rather than following the prescribed step-down procedure, however, the crew began a continuous descent from about 7600 ft MSL at about 11 NM from the airport to the accident site. The aircraft???s descent profile was well below the published step-down course for the entire approach. The aircraft impacted a mountain known as Cerro de Hula at the 4800 ft MSL elevation, approximately 800 ft below the summit, 4.8 NM from the Tegucigalpa runway 01 threshold. At impact, the aircraft was in approach configuration.
12157.0	12157.0	0.0	25.0	1990.0	1991.0	6.0								213.0	10.0	223.0	213.0	10.0	223.0	0.0	0.0	213.0		Boeing	International Scheduled Passenger	Thailand	En route (ENR)	En route	ENR	Fatalities: 10 / Occupants: 10	Destroyed	No	5/26/1991	24628/283	1989-09-26 (1 year 8 months)	Boeing 767-3Z9ER	767-3Z9ER	Final	Bangkok-Don Muang International Airport (BKK/VTBD), Thailand	Thailand	Don Mueang International Airport (DMK), 222 Vibhavadi Rangsit Rd, Khwaeng Sanambin, Khet Don Mueang, Krung Thep Maha Nakhon 10210, Thailand	13.9132602	100.6041987	Wien-Schwechat International Airport (VIE/LOWW), Austria	Austria	Vienna International Airport (VIE), Wien-Flughafen, 1300 Schwechat, Austria	48.1158333	16.5665751	5,6 km (3.5 mls) NNE of Phu Toey (Thailand)	Fatalities: 213 / Occupants: 213	Fatalities: 223 / Occupants: 223	Sunday 26 May 1991	OE-LAV	Lauda Air	"Lauda Air Flight NG004 was a scheduled service from Hong Kong (HKG) back to Vienna (VIE), Austria. An intermediate stop was made in Bangkok (BKK), Thailand. The flight departed Bangkok at 23:02 hours. Some five minutes after takeoff the pilot-in-command stated ""that keeps coming on,"" referring to a REV ISLN advisory warning. This indication appears when a fault has been detected in the thrust reverser system. The crew discussed the REV ISLN indication for about four and one-half minutes. The co-pilot read information from the Airplane Quick Reference Handbook as follows: ""Additional systems failures may cause in- flight deployment"" and ""Expect normal reverser operation after landing."" The pilot-in-command remarked ""....its not just on, its coming on and off,"" he said, ""...its just an advisory thing...,"" and shortly thereafter stated, ""could be some moisture in there or something."" At 23:12, the co-pilot advised the pilot-in-command that there was need for, ""a little bit of rudder trim to the left."" Fifteen minutes and one second into the flight the co-pilot exclaimed, ""ah reverser's deployed,"" accompanied by sound similar to airframe shuddering, sounds of metallic snaps and the pilot-in-command stating ""here wait a minute."" With the deployment of the nr.1 engine thrust reverser, engine thrust was reduced to idle. Aerodynamic effects of the reverser plume in-flight during the engine run down to idle resulted in a 25 percent lift loss across the wing. The airplane stalled and entered an uncontrolled descent. Buffeting, maneuvering overload, and excessive speed caused pieces of the rudder and the left elevator to separate. This was followed by the down-and-aft separation of most of the right horizontal stabilizer from maneuvering overloads, as the crew attempted to control the airplane and arrest the high-speed descent. A torsional overload then caused the separation of the vertical and left horizontal stabilizers. The loss of the tail resulted in a sharp nose-over of the airplane, producing excessive negative loading of the wing. A downward wing failure was probably followed by the breakup of the fuselage. The complete breakup of the tail, wing, and fuselage occurred in a matter of seconds. The wreckage fell in mountainous jungle terrain."
12181.0	12196.0	0.0	13.0	1990.0	1991.0	6.0								247.0	14.0	261.0	247.0	14.0	261.0	0.0	0.0	247.0		McDonnell Douglas	Int'l Non Scheduled Passenger	Saudi Arabia	Approach (APR)	Approach	APR	Fatalities: 14 / Occupants: 14	Destroyed	No	7/11/1991	45982/345	1968	McDonnell Douglas DC-8-61	DC-8	Final	Jeddah-King Abdulaziz International Airport (JED/OEJN), Saudi Arabia	Saudi Arabia	King Abdulaziz International Airport, Jeddah 23631, Saudi Arabia	21.6658971	39.1717627	Sokoto Airport (SKO/DNSO), Nigeria	Nigeria	Sadiq Abubakar III International Airport (SKO), Nigeria	12.9177112	5.2084001	2,8 km (1.8 mls) Jeddah-King Abdulaziz International Airport (JED) (Saudi Arabia)	Fatalities: 247 / Occupants: 247	Fatalities: 261 / Occupants: 261	Thursday 11 July 1991	C-GMXQ	0	"A McDonnell Douglas DC-8-61 passenger plane, registered C-GMXQ was destroyed in an accident near Jeddah-King Abdulaziz International Airport (JED), Saudi Arabia. All 261 on board were killed.The DC-8 jetliner was owned by Canadian airline Nationair which operated the plane on behalf of Nigeria Airways to fly hajj pilgrims between Nigeria and Saudi Arabia. Air Nigeria flight 2120 took off from Jeddah's runway 34L at 08:28, bound for Sokoto (SKO), Nigeria.About 15 seconds after brake release an oscillating sound was heard in the cockpit. Within two seconds, the flight engineer said: ""What's that?"" The first officer replied: ""We gotta flat tire, you figure?"" Two seconds later, an oscillating sound was again heard. The captain asked the first officer: ""You're not leaning on the brakes, eh?"" The first officer responded: ""No, I 'm not, I got my feet on the bottom of the rudder."" By this time, the aircraft had accelerated to about 80 knots. Marks on the runway showed that the No.1 wheel started to break up at about this time. In addition, the left and right flanges of No.2 wheel began to trace on the runway; rubber deposit from No.2 tire continued which appeared to be from a deflated tire between the flanges.At 28 seconds after brake release, a speed of 90 knots was called by the captain and acknowledged by the first officer. The captain called V1 about 45 seconds after brake release. Two seconds later, the first officer noted ""sort of a shimmy like if you're riding on one of those ah thingamajigs."" The captain called ""rotate"" 51 seconds after brake release and the airplane lifted off the runway.Witnesses noticed flames in the area of the left main landing gear. The flames disappeared when the undercarriage was retracted.During the next three minutes several indications of system anomalies occurred, which included a pressurization system failure, a gear unsafe light and a loss of hydraulics.The captain requested a level-off at 2000 feet because of the pressurization problem. In his radio call the captain used the callsign ""Nationair 2120"" instead of ""Nigerian 2120"" and the controller mistook the transmission to be from a Saudi flight returning to Jeddah and cleared The Jeddah bound aircraft to 3000 feet. The captain ofthe accident aircraft, however, acknowledged the ATC transmission without a call sign, saying ""understand you want us up to 3000 feet.""This misunderstanding continued for the next three minutes with ATC assuming that all calls were from the Saudi flight, not from the accident aircraft.About four minutes after brake release the captain called ATC and reported that the aircraft was leveling at 3000 feet. The first officer then interrupted with "" ... declaring an emergency. We 're declaring an emergency at this time. We believe we have ah, blown tires.""As the aircraft continued on the downwind heading, a flight attendant came into the cockpit and reported ""smoke in the back ... real bad."" A few moments later, the first officer said ""I've got no ailerons.""The captain responded: ""OK, hang on, I've got it."" It was the last record on the CVR, which failed (along with the flight data recorder [FDR]) at 08:33:33.The ATC controller gave a heading to intercept the final approach and thereafter continued to give heading information.Meanwhile, during the downwind and base legs, the fire had consumed the cabin floor above the wheel wells , permitting cabin furnishing to sag into the wheel wells. When the gear was probably extended at 11 miles on the final approach, the first body fell out because fire had burned through the seat harness. Subsequently, with the gear down and a forceful air supply through the open gear doors, rapid destruction of more floor structure permitted the loss of more bodies and seat assemblies. Despite the considerable destruction to the airframe, the aircraft appeared to be controllable.Eight minutes after brake release and 10 miles from the runway, the captain declared an emergency for the third time, saying, ""Nigeria 2120 declaring an emergency, we are on fire, we are on fire, we are returning to base immediately.""The aircraft came in nose down and crashed 9,433 feet (2,875 meters) short of the runway at 08:38."
12223.0	12223.0	0.0	82.0	1990.0	1991.0	6.0								122.0	12.0	134.0	121.0	12.0	133.0	1.0	2.0	122.0		Lockheed	Military	Indonesia	Initial climb (ICL)	Initial climb	ICL	Fatalities: 12 / Occupants: 12	Destroyed	No	10/5/1991	4927	1982	Lockheed C-130H-30 Hercules	C-130H-30 Hercules	0	Jakarta-Halim Perdana Kusuma Airport (HLP/WIHH), Indonesia	Indonesia	Halim Perdanakusuma Airport, Jalan Halim Perdana Kusuma, RT.13/RW.4, Halim Perdana Kusumah, Makasar, Halim Perdana Kusumah, Makasar, Kota Jakarta Timur, Daerah Khusus Ibukota Jakarta 13610, Indonesia	-6.2649026	106.8864668	Bandung-Husein Sastranegara Airport (BDO/WICC), Indonesia	Indonesia	null			3 km (1.9 mls) S of Jakarta-Halim Perdana Kusuma Airport (HLP) (Indonesia)	Fatalities: 121 / Occupants: 122	Fatalities: 133 / Occupants: 134	Saturday 5 October 1991	A-1324	Tentara Nasional Indonesia-AU (Air Force)	The Hercules was carrying airmen who had just participated in an Armed Forces Day ceremony. Shortly after takeoff from Jakarta-Halim Perdana Kusuma Airport (HLP) an engine was said to have caught fire. Control was apparently lost as the airplane plowed into a Department of Labor training center and caught fire. Two security guards on the ground were killed.
12425.0	12425.0	0.0	51.0	1990.0	1992.0	6.0								0.0	0.0	158.0	0.0	0.0	158.0	0.0	0.0	0.0		Lockheed	Military	Nigeria	En route (ENR)	En route	ENR	Fatalities: / Occupants:	Destroyed	No	9/26/1992	4624	1975	Lockheed C-130H Hercules	C-130H Hercules	0	Lagos-Murtala Muhammed International Airport (LOS/DNMM), Nigeria	Nigeria	Murtala Muhammed International Airport, Ikeja 23401, Lagos, Nigeria	6.5818185	3.3211348	Kaduna Airport (KAD/DNKA), Nigeria	Nigeria	Kaduna International Airport, Kaduna, Nigeria	10.6940852	7.3230951	near Lagos (Nigeria)	Fatalities: / Occupants:	Fatalities: 158 / Occupants: 158	Saturday 26 September 1992	NAF911	Nigerian Air Force - NAF	A Lockheed C-130H Hercules??transport plane, serial NAF911, was destroyed when it crashed near Lagos, Nigeria. All aboard were killed.The C-130H operated on a personnel flight from Lagos to Kaduna and Jos, Nigeria. All passengers were middle ranking officers who had been in Lagos on a Naval tour as part of the senior division course. The flight took off about 17:30. Immediately after takeoff one engine failed, followed by a second engine shortly afterwards. The crew tried to ditch the fully-laden plane in the Ejigbo canal, but then a third engine failed as well. The Hercules crashed nose-down into the swamp. There was no manifest, making estimates of precisely how many were onboard difficult. It was said that 168 students had been in Lagos. Because the flight was delayed for two days some had made other plans to fly home. Some reports claim there were 163 on board, others 174 or even 200 including some unidentified civilians, and possible military personnel who hitched a ride.In any case, a total 150 Nigerians, 5 Ghanaians, 1 Tanzanian, 1 Zimbabwean, and 1 Ugandan military officers were confirmed to have died.
12426.0	12426.0	0.0	44.0	1990.0	1992.0	6.0								148.0	19.0	167.0	148.0	19.0	167.0	0.0	0.0	148.0		Airbus	International Scheduled Passenger	Nepal	Approach (APR)	Approach	APR	Fatalities: 19 / Occupants: 19	Destroyed	No	9/28/1992	25	1976-03-23 (16 years 6 months)	Airbus A300B4-203	A300B4-203	Final	Karachi International Airport (KHI/OPKC), Pakistan	Pakistan	Jinnah International Airport, Airport Road، Karachi, Pakistan	24.9008297	67.16808259999999	Kathmandu-Tribhuvan Airport (KTM/VNKT), Nepal	Nepal	Tribhuvan International Airport (KTM), Ring Rd, Kathmandu 44600, Nepal	27.6980899	85.3592231	18 km (11.3 mls) S of Kathmandu-Tribhuvan Airport (KTM) (Nepal)	Fatalities: 148 / Occupants: 148	Fatalities: 167 / Occupants: 167	Monday 28 September 1992	AP-BCP	Pakistan International Airlines - PIA	PIA Flight 268 departed Karachi (KHI) at 11:13 for a flight to Kathmandu (KTM). The en route portion of the flight was uneventful and the aircraft was cleared for a Sierra approach to Kathmandu runway 02. The crew were instructed to maintain 11500 feet and report at 16DME (16 miles from the VOR/DME beacon, which is located 0,6 nm short of the runway). The Kathmandu approach is very difficult, since the airport is located in an oval-shaped valley surrounded by mountains as high as 9665 feet. Runway elevation is 4313 feet amsl. The next approach fixes for PIA268 were at 13 DME (at 10500 feet), 10 DME (at 9500 feet) and 8 DME (at 8200 feet). A few seconds after reporting 10 DME, the aircraft was descending through 8200 feet- which was the altitude for 8 DME. The Airbus crashed into a steep cloud-covered hillside at approx. 7300 feet amsl., at 9,16 DME.
12451.0	12451.0	0.0	76.0	1990.0	1992.0	6.0								131.0	10.0	141.0	131.0	10.0	141.0	0.0	0.0	131.0		Boeing	Domestic Non Scheduled Passenger	China	Approach (APR)	Approach	APR	Fatalities: 10 / Occupants: 10	Destroyed	No	11/24/1992	24913/2052	1991-05-10 (1 year 7 months)	Boeing 737-3Y0	737-3Y0	0	Guangzhou-Baiyun Airport (CAN/ZGGG), China	China	Guangzhou Baiyun International Airport (CAN), Baiyun, Guangzhou Shi, Guangdong Sheng, China	23.3959079	113.3079699	Guilin Airport (KWL/ZGKL), China	China	Guilin Liangjiang International Airport (KWL), Lingui Qu, Guilin Shi, Guangxi Zhuangzuzizhiqu, China	25.2158795	110.0470653	20 km (12.5 mls) S of Guilin Airport (KWL) (China)	Fatalities: 131 / Occupants: 131	Fatalities: 141 / Occupants: 141	Tuesday 24 November 1992	B-2523	China Southern Airlines	China Southern flight 3943 departed Guangzhou (CAN) on a flight to Guilin (KWL). The descent towards Guilin was carried out with autothrottle engaged. During the visual approach to runway 36, at an altitude of about 7000 feet, the captain attempted to level off the plane by raising the nose of the airplane. The autothrottle responded by advancing the throttles. The nr.2 power lever however remained at idle. The crew apparently did not notice this. With the nr.2 engine at idle, the autothrottle further advanced the nr.1 power lever in order to obtain the correct airspeed. The asymmetrical power condition was not corrected and the airplane rolled to the right. Control was lost and the airplane impacted terrain near Liutang.
12472.0	12473.0	0.0	53.0	1990.0	1992.0	6.0								147.0	10.0	157.0	147.0	10.0	157.0	0.0	0.0	147.0		Boeing	Domestic Scheduled Passenger	Libya	Approach (APR)	Approach	APR	Fatalities: 10 / Occupants: 10	Destroyed	No	12/22/1992	21050/1108	1975-02-07 (17 years 11 months)	Boeing 727-2L5	727-2L5	0	Benghazi-Benina International Airport (BEN/HLLB), Libya	Libya	Benina International Airport (BEN), P.O Box 1, Benghazi, Libya	32.0864576	20.2659758	Tripoli International Airport (TIP/HLLT), Libya	Libya	Tripoli International Airport, طريق المطار، Libya	32.669444	13.156667	9 km (5.6 mls) E of Tripoli International Airport (TIP) (Libya)	Fatalities: 147 / Occupants: 147	Fatalities: 157 / Occupants: 157	Tuesday 22 December 1992	5A-DIA	Libyan Arab Airlines	Collided with a MiG-23UB at 3500 feet and crashed.
12493.0	12493.0	0.0	88.0	1990.0	1993.0	6.0								119.0	12.0	131.0	119.0	12.0	131.0	0.0	0.0	119.0		Tupolev	Domestic Non Scheduled Passenger	Iran	En route (ENR)	En route	ENR	Fatalities: 12 / Occupants: 12	Destroyed	No	2/8/1993	91A-903	1991	Tupolev 154M	154M	0	Tehran-Mehrabad Airport (THR/OIII), Iran	Iran	Mehrabad International Airport (THR), Tehran, Iran	35.68998819999999	51.311241	Mashhad Airport (MHD/OIMM), Iran	Iran	Razavi Khorasan Province, Mashhad, Hasheminejad Blvd, Mashhad International Airport (MHD), Iran	36.2300516	59.64436989999999	15 km (9.4 mls) from Tehran-Mehrabad Airport (THR) (Iran)	Fatalities: 119 / Occupants: 119	Fatalities: 131 / Occupants: 131	Monday 8 February 1993	EP-ITD	Iran Air Tours	Mid-air collision between a Tu-154 (departing from runway 29R) and an Iranian Air Force Sukhoi SU-24 (on VFR approach to runway 29L).
12545.0	12545.0	0.0	84.0	1990.0	1993.0	6.0								125.0	7.0	132.0	125.0	7.0	132.0	0.0	0.0	125.0		Boeing	International Scheduled Passenger	Colombia	En route (ENR)	En route	ENR	Fatalities: 7 / Occupants: 7	Destroyed	No	5/19/1993	18876/217	1965-12-30 (27 years 5 months)	Boeing 727-46	727-46	0	Panama City-Tocumen International Airport (PTY/MPTO), Panama	Panama	Tocumen International Airport Panama, Avenida Domingo Díaz, Panamá, Panama	9.0667013	-79.38737429999999	Rionegro/Medell??n-Jos?? Mar??a C??rdova Airport (MDE/SKRG), Colombia	Colombia	José María Córdova International Airport, Rionegro, Antioquia, Colombia	6.170763399999999	-75.4276201	40 km (25 mls) SE of Medell??n (Colombia)	Fatalities: 125 / Occupants: 125	Fatalities: 132 / Occupants: 132	Wednesday 19 May 1993	HK-2422X	SAM Colombia	A Boeing 727-46 passenger plane, registered HK-2422X, was destroyed in an accident near Medell??n, Colombia. There were 125 passengers and seven crew members on board. All were killed.SAM Colombia flight 501 departed Panama City-Tocumen International Airport (PTY) on a scheduled service to Medell??n (MDE) and Bogot?? (BOG), Colombia.The crew reported over the Abejorral NDB beacon at FL160, approaching Medell??n. The flight was then cleared to descend to FL120. The 727 had actually not yet reached the beacon, and descended into mountainous terrain. The flight struck Mount Paramo Frontino at 12300 feet. Thunderstorm activity in the area made ADF navigation more difficult and the RNG VOR/DME had been attacked by terrorists and was unserviceable.
12722.0	12718.0	39.0	0.0	1990.0	1994.0	6.0	Airbus	International Scheduled Passenger	Russia	En route (ENR)	En route	ENR	Fatalities: 12 / Occupants: 12	63.0	12.0	75.0	63.0	12.0	75.0	0.0	0.0	63.0	Damaged beyond repair									No	3/23/1994	596	1991-09-11 (2 years 6 months)	Airbus A310-304	A310-304	0	Moskva-Sheremetyevo Airport (SVO/UUEE), Russia	Russia	Sheremetyevo International Airport, Khimki, Moscow Oblast, Russia, 141400	55.9736482	37.412503	Hong Kong-Kai Tak International Airport (HKG/VHHH), Hong Kong	Hong Kong	Hong Kong International Airport (HKG), 1 Sky Plaza Rd, Chek Lap Kok, Hong Kong	22.308047	113.9184808	near Mezhduretshensk (Russia)	Fatalities: 63 / Occupants: 63	Fatalities: 75 / Occupants: 75	Wednesday 23 March 1994	F-OGQS	Aeroflot Russian International Airlines	The aircraft was en route from Moscow to Hong Kong at 10100m when, approaching the Novokuznetsk reporting point, the captain's daughter entered the cockpit. She was allowed to sit the left-hand seat while the captain demonstrated some autopilot features, using HDG/S and NAV submodes to alter the heading. The captain's son then took the left front seat. The captain intended to demonstrate the same manoeuvre when his son asked if he could turn the control wheel. He then turned the wheel slightly (applying a force of between 8-10kg) and held it in that position for a few seconds before returning the wheel to the neutral position. The captain then demonstrated the same features as he did to his daughter and ended by using the NAV submode to bring the aircraft back on course. As the autopilot attempted to level the aircraft at its programmed heading, it came in conflict with the inputs from the control wheel which was blocked in a neutral position. Forces on the control wheel increased to 12-13kg until the torque limiter activated by disconnecting the autopilot servo from the aileron control linkage. The autopilot remained engaged however. The aircraft then started to bank to the right at 2,5deg/sec, reaching 45deg. when the autopilot wasn't able to maintain altitude. The A.310 started buffeting, which caught the attention of the captain who told the co-pilot to take control while he was trying to regain his seat. The seat of the co-pilot was fully aft, so it took him an additional 2-3 seconds to get to the control wheel. The bank continued to 90deg, the aircraft pitched up steeply with +4,8g accelerations, stalled and entered a spin. Two minutes and six seconds later the aircraft struck the ground.
