id	id2	unusual_flag	worst_flag	decade	year	month	make	nature	accident_country	phase_old	phase	phase_code	crew_text	passengers_occupants	crew_occupants	total_occupants	passengers_fatalities	crew_fatalities	total_fatalities	total_survivors	ground_casualties	passengers_occupants_old	airplane_damage	make	nature	accident_country	phase_old	phase	phase_code	crew_text	airplane_damage	Selected	date	cnmsn	first_flight	type	model	status	departure_airport	departure	departure_airport_formatted	departure_lat	departure_lng	destination_airport	destination_country	destination_airport_formatted	destination_lat	destination_lng	location_full	passengers_text	total_text	date_text	registration	operator	narrative
16144.0	16145.0	0.0	47.0	2010.0	2012.0	7.0								147.0	6.0	153.0	147.0	6.0	153.0	0.0	10.0	147.0		McDonnell Douglas	Domestic Scheduled Passenger	Nigeria	Approach (APR)	Approach	APR	Fatalities: 6 / Occupants: 6	Destroyed	No	6/3/2012	53019/1783	1990	McDonnell Douglas MD-83	C-17A Globemaster III	Preliminary - official	Abuja International Airport (ABV/DNAA), Nigeria	Nigeria	Nnamdi Azikiwe International Airport, Abuja, Abuja, Nigeria	9.007114999999999	7.263400099999999	Lagos-Murtala Muhammed International Airport (LOS/DNMM), Nigeria	Nigeria	Murtala Muhammed International Airport, Ikeja 23401, Lagos, Nigeria	6.5818185	3.3211348	9,3 km (5.8 mls) N of Lagos-Murtala Muhammed International Airport (LOS) (Nigeria)	Fatalities: 147 / Occupants: 147	Fatalities: 153 / Occupants: 153	Sunday 3 June 2012	5N-RAM	Dana Air	"A McDonnell Douglas MD-83 passenger plane, 5N-RAM, operated by Dana Air was destroyed when it crashed into a residential area of Lagos, Nigeria. All 147 passengers and six crew members were killed. There were 10 confirmed ground fatalities.The airplane was on the fourth flight segment of the day, consisting of two round-trips between Lagos and Abuja. The accident occurred during the return leg of the second trip. Flight DAN 992 initiated engine startup at 14:36, taxied to the runway and was later airborne at 14:58. Fuel endurance was 3.5 hours. The flight climbed to a cruise altitude of 26,000 ft.DAN 992 made contact with Lagos Area Control Center at 15:18. At the time the captain and first officer were in a discussion of a nonnormal condition regarding the correlation between the engine throttle setting and an engine power indication. However, they did not voice concerns then that the condition would affect the continuation of the flight. The flight crew continued to monitor the condition and became increasingly concerned as the flight transition through the initial descent from cruise altitude at 15:22 and the subsequent approach phase.DAN 992 reported passing through 18,100 and 7,700 ft, respectively, at 15:30 and 15:40. After receiving a series of heading and altitude assignments from the controller, DAN 992 was issued the final heading to intercept the final approach course for runway 18R.Between 15:37 and 15:41 the flight crew were engaged in pre-landing tasks including deployment of the slats, and extension of the flaps and landing gear. At 15:41:16 the first officer inquired, ""both engines coming up?"" and the captain replied ""negative."" The flight crew subsequently discussed and agreed to declare an emergency. At 15:42:10, DANA 992 radioed an emergency distress call indicating ""dual engine failure...negative response from throttle.""At 15:42:35, the flight crew lowered the flaps further and continued with the approach and discussed landing alternatively on runway 18L. At 15:42:45, the captain reported the runway in sight and instructed the first officer to raise the flaps and 4 seconds later to raise the landing gear.At 15:43:27 hours, the captain informed the first officer ""we just lost everything, we lost an engine. I lost both engines"". During the next 25 seconds the flight crew was attempting to restart the engines. The airplane did not reach the runway and crashed in a residential area about 9,3 km short of the runway 18R.During the impact sequence, the airplane struck an incomplete building, two trees and three buildings. The wreckage was confined, with the separated tail section and engines located at the beginning of the debris field. A fire erupted.Weather reported about at 15:00 UTC (16:00 local time):DNMM 031500Z 19007KT 140V230 9999 SCT014 30/23 Q1013 NOSIGWind 190 degrees at 7 knots; winds varying between 140 and 230 degrees; Visibility 10+ km; Scatter clouds at 1400 feet; Temperature 30??C, Dew point 23??C; pressure 1013 mb."
16268.0	16270.0	0.0	17.0	2010.0	2014.0	7.0								227.0	12.0	239.0	227.0	12.0	239.0	0.0	0.0	227.0		Boeing	International Scheduled Passenger	Indian Ocean	En route (ENR)	En route	ENR	Fatalities: 12 / Occupants: 12	Missing	No	3/8/2014	28420/404	2002-05-14 (11 years 10 months)	Boeing 777-2H6ER	777-2H6ER	Preliminary	Kuala Lumpur International Airport (KUL/WMKK), Malaysia	Malaysia	Kuala Lumpur Int'l Airport (KUL), 64000 Sepang, Selangor, Malaysia	2.7350439	101.7010435	Beijing-Capital Airport (PEK/ZBAA), China	China	Beijing Capital International Airport (PEK), Shunyi, Beijing Shi, China	40.0798573	116.6031121	within Indian Ocean (Indian Ocean)	Fatalities: 227 / Occupants: 227	Fatalities: 239 / Occupants: 239	Saturday 8 March 2014	9M-MRO	Malaysia Airlines	"Malaysia Airlines Flight MH-370 from Kuala Lumpur, Malaysia to Beijing, China was reported missing. There were 227 passengers and 12 crew members on board.The Boeing 777-2H6ER took off from Kuala Lumpur International Airport's runway 32R at 00:41 and climbed to a cruising altitude of FL350.The flight flew a 25?? course towards the IGARI waypoint. At 01:07 Malaysian time the last ACARS message was received. Last radio contact was at 01:19 when the copilot radioed 'All right, good night."" At that moment the flight was approaching the IGARI waypoint. When making the planned course change over IGARI at 01:21, the transponder was switched off. Malaysian officials reported that the civil radar lost contact at 01:30 at a position 2 km south of IGARI.From this point onwards, the Royal Malaysian Air Force primary radar showed that MH370 turned back. It then flew in a westerly direction back over peninsular Malaysia before turning northwest. Unconfirmed media reports suggest that the airplane climbed to 45,000 feet, above the approved altitude limit for a Boeing 777-200, soon after it disappeared from civilian radar. The plane then descended unevenly to 23,000 feet. The plane was reportedly last recorded flying at 29,500 feet when radar contact was lost.Authorities believe that up until the point at which it left military primary radar coverage, at 02:15, these movements are consistent with deliberate action by someone on the aircraft. Last satellite data was recorded at 08:11 Malaysian time.A search for the airplane was being conducted in an area near a possible corridor in the Indian Ocean with a focus on objects spotted in the Indian Ocean, about 2550 km SW off Perth, Australia. New data analysis later revealed that the airplane might been flying faster, suggesting the airplane ran out of fuel in an area about 1,100 km northeast of the previous search zone."
254.0	255.0	2.0	0.0	1930.0	1937.0	4.0	Douglas	Domestic Scheduled Passenger	United States of America	Approach (APR)	Approach	APR	Fatalities: 2 / Occupants: 2	9.0	2.0	11.0	9.0	2.0	11.0	0.0	0.0	9.0	Damaged beyond repair									No	2/9/1937	1913	1936	Douglas DC-3A-197	DC-3A-197	Final	Burbank-Union Air Terminal (BUR/KBUR), United States of America	United States of America	Bob Hope Airport (BUR), 2627 N Hollywood Way, Burbank, CA 91505, USA	34.1983122	-118.3574036	San Francisco Municipal Airport, CA (SFO/KSFO), United States of America	United States of America	San Francisco International Airport (SFO), San Francisco, CA 94128, USA	37.6213129	-122.3789554	3 km (1.9 mls) off San Francisco Municipal Airport, CA (SFO) (United States of America)	Fatalities: 9 / Occupants: 9	Fatalities: 11 / Occupants: 11	Tuesday 9 February 1937	NC16073	United Air Lines	Crashed into San Francisco Bay while on approach. The co-pilot dropped his microphone which jammed the controls, preventing the pilot from pulling out of the glide. Nine passengers and two crew died.
3675.0	3676.0	3.0	0.0	1940.0	1947.0	4.0	Avro	International Scheduled Passenger	Argentina	En route (ENR)	En route	ENR	Fatalities: 5 / Occupants: 5	6.0	5.0	11.0	6.0	5.0	11.0	0.0	0.0	6.0	Damaged beyond repair									No	8/2/1947	1280	0	Avro 691 Lancastrian 3	691 Lancastrian 1	Preliminary	Buenos Aires (unknown airport), BA, Argentina	Argentina	Aeroparque Internacional Jorge Newbery (AEP), Av. Costanera Rafael Obligado s/n, C1425 CABA, Argentina	-34.5580305	-58.4170088	Santiago-Los Cerrillos Airport (ULC/SCTI), Chile	Indonesia	Los Cerrillos, Cerrillos, Región Metropolitana, Chile	-33.4954605	-70.6940137	Tupungato Mountain (Argentina)	Fatalities: 6 / Occupants: 6	Fatalities: 11 / Occupants: 11	Saturday 2 August 1947	G-AGWH	British South American Airways - BSAA	Went missing over the Andes mountains while on a flight to Buenos Aires. Climbers found the wreckage January 2000 at over 5,000 meters above sea-level on top of Argentina's Tupungato Mountain, close to the Chilean border.
3713.0	3714.0	4.0	0.0	1940.0	1947.0	4.0	Douglas	Domestic Scheduled Passenger	United States of America	En route (ENR)	En route	ENR	Fatalities: 5 / Occupants: 5	47.0	5.0	52.0	47.0	5.0	52.0	0.0	0.0	47.0	Damaged beyond repair									No	10/24/1947	42875/17	1947	Douglas DC-6	DC-6	Final	Los Angeles Airport, CA (LAX/KLAX), United States of America	United States of America	Los Angeles International Airport (LAX), 1 World Way, Los Angeles, CA 90045, USA	33.9415889	-118.40853	Chicago Municipal Airport, IL (MDW/KMDW), United States of America	United States of America	Chicago Midway International Airport (MDW), 5700 S Cicero Ave, Chicago, IL 60638, USA	41.78677589999999	-87.7521884	2,4 km (1.5 mls) SE of Bryce Canyon Airport, UT (BCE) (United States of America)	Fatalities: 47 / Occupants: 47	Fatalities: 52 / Occupants: 52	Friday 24 October 1947	NC37510	United Air Lines	"Flight 608 departed Los Angeles at 10:23 for a non-stop flight to Chicago. The airplane climbed to 19,000 feet and proceeded VFR over Fontana, Daggett and Silver Lake, Las Vegas, and Saint George. At 12:21 Flight 608 reported that a fire had been detected in the baggage compartment which the crew was unable to extinguish. The report added that the cabin was filled with smoke and that the flight was attempting to make an emergency landing at Bryce Canyon Airport (BCE). The fire had erupted in the center section in the vicinity of the right wing fillet. Small parts of the airplane were lost in flight and at least one of the emergency landing flares which are located at the trailing edge of the right wing fillet ignited in flight. Shortly thereafter the flight again reported that the ""tail is going out-we may get down and we may not."" At 12:26 another transmission was received fromthe flight indicating that it was going into the ""best place available."" One minute later the flight reported ""we may make it-approaching a strip."" This was the last contact with the flight. It crashed at 12:29 before it was able to reach the airport.After the accident, investigators noted that the DC-6 airplane design included a No.3 alternate fuel tank vent outlet that was located on the right side of the fuselage near the leading edge of the wing and close to the bottom wing fillet. Approximately 10 feet aft of this point and slightly to the left there was an air scoop which served as a source of cabin heater combustion air and cooling air for the cabin supercharger air after-cooler and cabin supercharger oil cooler. Flight tests conducted with other model DC-6 aircraft subsequent to the accident revealed that overflow from the No. 3 alternate tank through the air vent line and out the vent outlet would sweep back in the slip stream toward the cabin heater combustion air intake scoop and that a considerable quantity of fuel would enter the scoop. Ground tests clearly demonstrated that, under conditions simulating the entry of fuel overflow into the scoop inflight while the heater was operating, the cabin heater could be expected to backfire and thereby propagate flame downstream into the air scoop. Incoming fuel would, thereafter, be expected to continue to burn in the air scoop and duct."
4114.0	4115.0	5.0	0.0	1940.0	1949.0	4.0	Douglas	Domestic Scheduled Passenger	Canada	En route (ENR)	En route	ENR	Fatalities: 4 / Occupants: 4	19.0	4.0	23.0	19.0	4.0	23.0	0.0	0.0	19.0	Damaged beyond repair									No	9/9/1949	4518	1942	Douglas C-47-DL	C-47-DL	0	Quebec Airport, QC (YQB/CYQB), Canada	Canada	Québec City Jean Lesage International Airport (YQB), 505 Rue Principale, Ville de Québec, QC G2G 0J4, Canada	46.7907719	-71.38856899999999	Baie Comeau Airport, QC (YBC/CYBC), Canada	Democratic Repuglic of Congo	Airport Baie-Comeau / Pointe-Lebel, 200 Route de l'Aéroport, Baie-Comeau, QC G5C 2S6, Canada	49.13671009999999	-68.2003124	Sault-aux-Cochon, QC (Canada)	Fatalities: 19 / Occupants: 19	Fatalities: 23 / Occupants: 23	Friday 9 September 1949	CF-CUA	Canadian Pacific Air Lines - CPAL	Crashed following the explosion of a time bomb, placed in the no. 1 forward baggage hold.It was found out that Albert Guay wanted to kill his wife in order to marry another woman (Marie-Ange Robitaille) and get his wife's life insurance policy (USD 10,000). An accomplice constructed a time bomb which was placed aboard DC-3 CF-CUA. Mrs Rita Morel Guay boarded the aircraft for a flight to Baie Comeau and was killed in the accident. Mr Guay and the accomplices all received the death penalty.
4832.0	4832.0	0.0	92.0	1950.0	1953.0	5.0								122.0	7.0	129.0	122.0	7.0	129.0	0.0	0.0	122.0		Douglas	Military	Japan	Approach (APR)	Approach	APR	Fatalities: 7 / Occupants: 7	Destroyed	No	6/18/1953	43471	0	Douglas C-124A-DL Globemaster II	C-124A-DL Globemaster II	0	Tachikawa AB (RJTC), Japan	Japan	Tachikawa Airfield, Midoricho, Tachikawa, Tokyo 190-0014, Japan	35.7109011	139.40232	Seoul-Gimpo (Kimpo) International Airport (SEL/RKSS), South Korea	South Korea	Gimpo International Airport (GMP), 112 Haneul-gil, Gangseo-gu, Seoul, South Korea	37.5586545	126.7944739	5,6 km (3.5 mls) NE of Tachikawa AB (Japan)	Fatalities: 122 / Occupants: 122	Fatalities: 129 / Occupants: 129	Thursday 18 June 1953	51-0137	United States Air Force - USAF	"Visibility was 2,5 miles as the Douglas Globemaster transporter took off from Tachikawa AB, Japan, bound for Korea. Shortly after takeoff an engine failed. The pilot radioed ""One engine out, returning to field for GCA landing"". While on approach back to the air base, an improper use of flaps caused a loss of airspeed. Control was lost and the airplane crashed into a watermelon patch, broke up and caught fire."
5233.0	5233.0	6.0	0.0	1950.0	1955.0	5.0	Douglas	Domestic Scheduled Passenger	United States of America	En route (ENR)	En route	ENR	Fatalities: 5 / Occupants: 5	39.0	5.0	44.0	39.0	5.0	44.0	0.0	0.0	39.0	Damaged beyond repair									No	11/1/1955	43538/224	1952	Douglas DC-6B	DC-6B	0	Denver-Stapleton International Airport, CO (DEN/KDEN), United States of America	United States of America	Denver International Airport (DEN), 8500 Peña Blvd, Denver, CO 80249, USA	39.8560963	-104.6737376	Portland International Airport, OR (PDX/KPDX), United States of America	United States of America	Portland International Airport (PDX), 7000 NE Airport Way, Portland, OR 97218, USA	45.58976939999999	-122.5950942	Longmont, CO (United States of America)	Fatalities: 39 / Occupants: 39	Fatalities: 44 / Occupants: 44	Tuesday 1 November 1955	N37559	United Air Lines	Crashed following the in-flight detonation of a bomb.
5426.0	5426.0	7.0	0.0	1950.0	1957.0	5.0	Douglas	Domestic Scheduled Passenger	United States of America	Initial climb (ICL)	Initial climb	ICL	Fatalities: 0 / Occupants: 6	95.0	6.0	101.0	20.0	0.0	20.0	81.0	0.0	95.0	Damaged beyond repair									No	2/1/1957	44678/543	1955	Douglas DC-6A	DC-6A	Final	New York-La Guardia Airport, NY (LGA/KLGA), United States of America	United States of America	LaGuardia Airport (LGA), Queens, NY 11371, USA	40.7769271	-73.8739659	Miami International Airport, FL (MIA/KMIA), United States of America	United States of America	Miami International Airport (MIA), 2100 NW 42nd Ave, Miami, FL 33126, USA	25.795865	-80.2870457	Rikers Island, NY (United States of America)	Fatalities: 20 / Occupants: 95	Fatalities: 20 / Occupants: 101	Friday 1 February 1957	N34954	Northeast Airlines	Northeast Flight 823 to Miami (MIA) was scheduled to depart from New York-La Guardia (LGA) at 14:45. Snowfall delayed the departure. Carrying 95 passengers and 6 crewmembers, the gross weight of the aircraft was 98575 pounds, 265 pounds below maximum weight. The crew started the takeoff roll on runway 04 at 18:01. Except for some sliding of the nose wheel at low speed, the takeoff roll was normal. A positive rate of climb was established and the gear was retracted, flaps raised and METO power set. The crew went on instruments immediately after gear retraction and the captain monitored airspeed, rate of climb and direction. the aircraft was to climb on runway heading, but started turning to the left. This was not noticed by the crew. While over Rikers Island on a 285deg heading, the DC-6 first struck small trees. The left wingtip touched the ground; the right wingtip 150 feet beyond. The plane then skidded 1500 feet. Impact occurred about 60 seconds after the start of takeoff.
5880.0	5880.0	8.0	0.0	1950.0	1959.0	5.0	Martin	Domestic Scheduled Passenger	United States of America	Approach (APR)	Approach	APR	Fatalities: 4 / Occupants: 4	22.0	4.0	26.0	21.0	4.0	25.0	1.0	0.0	22.0	Destroyed									No	12/1/1959	9159	1947	Martin 2-0-2	2-0-2	Final	Harrisburg-Capital Landing Field, PA (HAR/KCXY), United States of America	United States of America				Williamsport-Lycoming County Airport, PA (IPT/KIPT), United States of America	Yemen	Williamsport Regional Airport, 700 Airport Rd, Montoursville, PA 17754, USA	41.245283	-76.918905	2,1 km (1.3 mls) S of Williamsport-Lycoming County Airport, PA (IPT) (United States of America)	Fatalities: 21 / Occupants: 22	Fatalities: 25 / Occupants: 26	Tuesday 1 December 1959	N174A	Allegheny Airlines	Allegheny Flight 371 was scheduled between Philadelphia, PA, and Cleveland, OH with stops at Harrisburg (HAR), Williamsport (IPT), Bradford, and Erie. Flight 371 departed Philadelphia at 08:15, proceeded VFR to Harrisburg where it landed at 08:5l without incident. Flight 371 departed Harrisburg at 09:06 with 22 revenue passengers, one additional crew member9 and 598 pounds of baggage, mail, and cargo.At 09:23 Flight 371 reported to Williamsport radio that it was making 360-degree turns five minutes south of the Williamsport low frequency range at an altitude of 3,500 feet, VFR and requested an instrument clearance to theWilliamsport Airport. Williamsport radio responded by giving the 09:17 Williamsport weather observation, which was: Precipitation ceiling 1,000 feet, sky obscured; visibility one mile in light snow, wind west at five knots; altimeter 30.26 At this time Williamsport radio requested that the flight stand by for clearance At 09:27 Flight 371 was cleared direct to the Williamsport low frequency range from its present position, to maintain 4,000 feet. At 09:33 Flight 371 was cleared for an approach to the Williamsport Airport, to report on the ground, or cancelling IFR. At this time Flight 371 reported over the Williamsport low frequency range, leaving 4,000 feet, and commencing an approach At 09:35 the Williamsport 09:34 weather observation was given as being 1,000-feet scattered, precipitation observation 7,000 feet; visibility 1-1/2 miles in light snow, wind west at four knots, altimeter setting 30.26 inches. Allegheny minimums for this approach to the Williamsport Airport are 900 feet ceiling and 1-1/2 miles visibility.At 09:41 Flight 371 reported over the low frequency range on final approach. At this time the flight was advised of the surface wind, altimeter setting, and that the runway lights were on high brilliancy on runway 9-27. Flight 371 acknowledged all of these transmissions from Williamsport radio. At 09:42 the flight reported in range to the company on company frequency. At this time the company advised that their altimeter setting was 30.25 inches and requested the arrival and departure times of the flight at Harrisburg. Flight 371 acknowledged the altimeter setting but did not relay the time information requested.It is believed that during the base leg the captain relied on the MDI of the fluxgate compass owing to the weather and cockpit visibility restrictions that existed. The fluxgate compass caging switch, located on the back of the pedestal, was probably accidentally actuated by the foot of the crew member occupying the jump seat during the initial part of the base leg.The captain continued his turn intending to roll out on the runway heading but reference to the MDI indicated that he had overshot his heading so he immediately turned to the left to an indicated heading of 270 degrees After rolling out on this heading he was unable to see the field which was now to his right and he continued on for a few seconds expecting to see the field momentarily. Owing to the induced error of approximately 80 degrees to the right the aircraft was now on an actual heading of approximately 190 degrees and the heading for Bald Eagle Mountain. The aircraft then encountered snow showers and clouds. The captain continued his flight on the indicated heading of 270 degrees for approximately 12 to 14 seconds, during which the aircraft was converging with the northern slope of Bald Eagle Mountain. During this time the captain noted the discrepancy between the MDI and his other directional instruments and caged the fluxgate compass in an effort to determine his correct heading. Upon completion of the caging cycle the MDI turned to a heading of approximately 190 degrees. At this time, just prior to the crash, the aircraft was turned to the right, full throttle was applied, and gear retraction was initiated. Before this turn could be completed the aircraft crashed into the trees and rocky terrain of the mountain at an elevation of 1,150 msl. Most of the passenger cabin area was consumed by the ground fire which followed the crash.
5901.0	5901.0	9.0	0.0	1960.0	1960.0	5.0	Douglas	Domestic Scheduled Passenger	United States of America	En route (ENR)	En route	ENR	Fatalities: 5 / Occupants: 5	29.0	5.0	34.0	29.0	5.0	34.0	0.0	0.0	29.0	Destroyed									No	1/6/1960	43742/300	1952	Douglas DC-6B	DC-6B	0	New York-Idlewild International Airport, NY (IDL/KIDL), United States of America	United States of America				Miami International Airport, FL (MIA/KMIA), United States of America	United States of America	Miami International Airport (MIA), 2100 NW 42nd Ave, Miami, FL 33126, USA	25.795865	-80.2870457	2,4 km (1.5 mls) from Bolivia, NC (United States of America)	Fatalities: 29 / Occupants: 29	Fatalities: 34 / Occupants: 34	Wednesday 6 January 1960	N8225H	National Airlines	The DC-6 was one of two aircraft substituted for a Boeing 707 which had incurred mechanical difficulty. En route to Miami the aircraft disintegrated in flight. Portions of the wreckage fell near Kura Beach and the major wreckage fell about 13 miles West of Kure Beach. It appeared that a dynamite explosion had occurred which was detonated by means of dry cell batteries. The explosion occurred near the right of seat row 7.
6010.0	6011.0	10.0	0.0	1960.0	1960.0	5.0	Lockheed	Domestic Scheduled Passenger	United States of America	Initial climb (ICL)	Initial climb	ICL	Fatalities: 3 / Occupants: 5	67.0	5.0	72.0	59.0	3.0	62.0	10.0	0.0	67.0	Damaged beyond repair									No	10/4/1960	1062	1959	Lockheed L-188A Electra	L-188A Electra	Final	Boston-Logan International Airport, MA (BOS/KBOS), United States of America	United States of America	Boston Logan International Airport (BOS), 1 Harborside Dr, Boston, MA 02128, USA	42.3656132	-71.0095602	Philadelphia International Airport, PA (PHL/KPHL), United States of America	United States of America	Philadelphia International Airport (PHL), 8000 Essington Ave, Philadelphia, PA 19153, USA	39.8743959	-75.2424229	ca 1 km E off Boston-Logan International Airport, MA (BOS) (United States of America)	Fatalities: 59 / Occupants: 67	Fatalities: 62 / Occupants: 72	Tuesday 4 October 1960	N5533	Eastern Air Lines	A few seconds after taking off from runway 05, the Electra struck a flock of starlings. A number of these birds were ingested in engine no.1, 2 and 4. Engine no. 1 was shut down and the prop feathered. Shortly after that the no. 2 and 4 engines experienced a substantial momentary loss of power. This caused the plane to yaw to the left and decelerate to stall speed. The left wing then dropped, the nose pitched up and the L-188 rolled left into a spin and fell almost vertically into the water.
