id,id2,unusual_flag,worst_flag,date,decade,year,month,cnmsn,first_flight,type,make,model,status,nature,departure_airport,departure_airport_formatted,departure_airport_lat,departure_airport_lng,departure,destination_airport,destination_airport_formatted,destination_airport_lat,destination_airport_lng,destination_country,accident_country,accident_location,accident_airport,location_full,phase_old,phase,phase_code,passengers_text,crew_text,total_text,passengers_occupants,crew_occupants,total_occupants,passengers_fatalities,crew_fatalities,total_fatalities,total_survivors,ground_casualties,total_occupants_old,passengers_occupants_old,airplane_damage,date_text,registration,operator,narrative
5880,5880,8,0,12/1/1959,1950,1959,5,9159,1947,Martin 2-0-2,Martin,2-0-2,Final,Domestic Scheduled Passenger,"Harrisburg-Capital Landing Field, PA (HAR/KCXY), United States of America",null,null,null, United States of America,"Williamsport-Lycoming County Airport, PA (IPT/KIPT), United States of America","Williamsport Regional Airport, 700 Airport Rd, Montoursville, PA 17754, USA",41.245283,-76.918905,Yemen,United States of America,,,"2,1 km (1.3 mls) S of Williamsport-Lycoming County Airport, PA (IPT) (United States of America)",Approach (APR),Approach ,APR,Fatalities: 21 / Occupants: 22,Fatalities: 4 / Occupants: 4,Fatalities: 25 / Occupants: 26,22,4,26,21,4,25,1,0,,22,Destroyed,Tuesday 1 December 1959,N174A,Allegheny Airlines,"Allegheny Flight 371 was scheduled between Philadelphia, PA, and Cleveland, OH with stops at Harrisburg (HAR), Williamsport (IPT), Bradford, and Erie. Flight 371 departed Philadelphia at 08:15, proceeded VFR to Harrisburg where it landed at 08:5l without incident. Flight 371 departed Harrisburg at 09:06 with 22 revenue passengers, one additional crew member9 and 598 pounds of baggage, mail, and cargo.At 09:23 Flight 371 reported to Williamsport radio that it was making 360-degree turns five minutes south of the Williamsport low frequency range at an altitude of 3,500 feet, VFR and requested an instrument clearance to theWilliamsport Airport. Williamsport radio responded by giving the 09:17 Williamsport weather observation, which was: Precipitation ceiling 1,000 feet, sky obscured; visibility one mile in light snow, wind west at five knots; altimeter 30.26 At this time Williamsport radio requested that the flight stand by for clearance At 09:27 Flight 371 was cleared direct to the Williamsport low frequency range from its present position, to maintain 4,000 feet. At 09:33 Flight 371 was cleared for an approach to the Williamsport Airport, to report on the ground, or cancelling IFR. At this time Flight 371 reported over the Williamsport low frequency range, leaving 4,000 feet, and commencing an approach At 09:35 the Williamsport 09:34 weather observation was given as being 1,000-feet scattered, precipitation observation 7,000 feet; visibility 1-1/2 miles in light snow, wind west at four knots, altimeter setting 30.26 inches. Allegheny minimums for this approach to the Williamsport Airport are 900 feet ceiling and 1-1/2 miles visibility.At 09:41 Flight 371 reported over the low frequency range on final approach. At this time the flight was advised of the surface wind, altimeter setting, and that the runway lights were on high brilliancy on runway 9-27. Flight 371 acknowledged all of these transmissions from Williamsport radio. At 09:42 the flight reported in range to the company on company frequency. At this time the company advised that their altimeter setting was 30.25 inches and requested the arrival and departure times of the flight at Harrisburg. Flight 371 acknowledged the altimeter setting but did not relay the time information requested.It is believed that during the base leg the captain relied on the MDI of the fluxgate compass owing to the weather and cockpit visibility restrictions that existed. The fluxgate compass caging switch, located on the back of the pedestal, was probably accidentally actuated by the foot of the crew member occupying the jump seat during the initial part of the base leg.The captain continued his turn intending to roll out on the runway heading but reference to the MDI indicated that he had overshot his heading so he immediately turned to the left to an indicated heading of 270 degrees After rolling out on this heading he was unable to see the field which was now to his right and he continued on for a few seconds expecting to see the field momentarily. Owing to the induced error of approximately 80 degrees to the right the aircraft was now on an actual heading of approximately 190 degrees and the heading for Bald Eagle Mountain. The aircraft then encountered snow showers and clouds. The captain continued his flight on the indicated heading of 270 degrees for approximately 12 to 14 seconds, during which the aircraft was converging with the northern slope of Bald Eagle Mountain. During this time the captain noted the discrepancy between the MDI and his other directional instruments and caged the fluxgate compass in an effort to determine his correct heading. Upon completion of the caging cycle the MDI turned to a heading of approximately 190 degrees. At this time, just prior to the crash, the aircraft was turned to the right, full throttle was applied, and gear retraction was initiated. Before this turn could be completed the aircraft crashed into the trees and rocky terrain of the mountain at an elevation of 1,150 msl. Most of the passenger cabin area was consumed by the ground fire which followed the crash."
5426,5426,7,0,2/1/1957,1950,1957,5,44678/543,1955,Douglas DC-6A,Douglas,DC-6A,Final,Domestic Scheduled Passenger,"New York-La Guardia Airport, NY (LGA/KLGA), United States of America","LaGuardia Airport (LGA), Queens, NY 11371, USA",40.7769271,-73.8739659,United States of America,"Miami International Airport, FL (MIA/KMIA), United States of America","Miami International Airport (MIA), 2100 NW 42nd Ave, Miami, FL 33126, USA",25.795865,-80.2870457,United States of America,United States of America,,,"Rikers Island, NY (United States of America)",Initial climb (ICL),Initial climb ,ICL,Fatalities: 20 / Occupants: 95,Fatalities: 0 / Occupants: 6,Fatalities: 20 / Occupants: 101,95,6,101,20,0,20,81,0,,95,Damaged beyond repair,Friday 1 February 1957,N34954,Northeast Airlines,"Northeast Flight 823 to Miami (MIA) was scheduled to depart from New York-La Guardia (LGA) at 14:45. Snowfall delayed the departure. Carrying 95 passengers and 6 crewmembers, the gross weight of the aircraft was 98575 pounds, 265 pounds below maximum weight. The crew started the takeoff roll on runway 04 at 18:01. Except for some sliding of the nose wheel at low speed, the takeoff roll was normal. A positive rate of climb was established and the gear was retracted, flaps raised and METO power set. The crew went on instruments immediately after gear retraction and the captain monitored airspeed, rate of climb and direction. the aircraft was to climb on runway heading, but started turning to the left. This was not noticed by the crew. While over Rikers Island on a 285deg heading, the DC-6 first struck small trees. The left wingtip touched the ground; the right wingtip 150 feet beyond. The plane then skidded 1500 feet. Impact occurred about 60 seconds after the start of takeoff."
5233,5233,6,0,11/1/1955,1950,1955,5,43538/224,1952,Douglas DC-6B,Douglas,DC-6B,0,Domestic Scheduled Passenger,"Denver-Stapleton International Airport, CO (DEN/KDEN), United States of America","Denver International Airport (DEN), 8500 Peña Blvd, Denver, CO 80249, USA",39.8560963,-104.6737376,United States of America,"Portland International Airport, OR (PDX/KPDX), United States of America","Portland International Airport (PDX), 7000 NE Airport Way, Portland, OR 97218, USA",45.58976939999999,-122.5950942,United States of America,United States of America,,,"Longmont, CO (United States of America)",En route (ENR),En route ,ENR,Fatalities: 39 / Occupants: 39,Fatalities: 5 / Occupants: 5,Fatalities: 44 / Occupants: 44,39,5,44,39,5,44,0,0,,39,Damaged beyond repair,Tuesday 1 November 1955,N37559,United Air Lines,Crashed following the in-flight detonation of a bomb.
4114,4115,5,0,9/9/1949,1940,1949,4,4518,1942,Douglas C-47-DL,Douglas,C-47-DL,0,Domestic Scheduled Passenger,"Quebec Airport, QC (YQB/CYQB), Canada","Québec City Jean Lesage International Airport (YQB), 505 Rue Principale, Ville de Québec, QC G2G 0J4, Canada",46.7907719,-71.38856899999999, Canada,"Baie Comeau Airport, QC (YBC/CYBC), Canada","Airport Baie-Comeau / Pointe-Lebel, 200 Route de l'Aéroport, Baie-Comeau, QC G5C 2S6, Canada",49.13671009999999,-68.2003124,Democratic Repuglic of Congo,Canada,,,"Sault-aux-Cochon, QC (Canada)",En route (ENR),En route ,ENR,Fatalities: 19 / Occupants: 19,Fatalities: 4 / Occupants: 4,Fatalities: 23 / Occupants: 23,19,4,23,19,4,23,0,0,,19,Damaged beyond repair,Friday 9 September 1949,CF-CUA,Canadian Pacific Air Lines - CPAL,"Crashed following the explosion of a time bomb, placed in the no. 1 forward baggage hold.It was found out that Albert Guay wanted to kill his wife in order to marry another woman (Marie-Ange Robitaille) and get his wife's life insurance policy (USD 10,000). An accomplice constructed a time bomb which was placed aboard DC-3 CF-CUA. Mrs Rita Morel Guay boarded the aircraft for a flight to Baie Comeau and was killed in the accident. Mr Guay and the accomplices all received the death penalty."
3713,3714,4,0,10/24/1947,1940,1947,4,42875/17,1947,Douglas DC-6,Douglas,DC-6,Final,Domestic Scheduled Passenger,"Los Angeles Airport, CA (LAX/KLAX), United States of America","Los Angeles International Airport (LAX), 1 World Way, Los Angeles, CA 90045, USA",33.9415889,-118.40853, United States of America,"Chicago Municipal Airport, IL (MDW/KMDW), United States of America","Chicago Midway International Airport (MDW), 5700 S Cicero Ave, Chicago, IL 60638, USA",41.78677589999999,-87.7521884,United States of America,United States of America,,,"2,4 km (1.5 mls) SE of Bryce Canyon Airport, UT (BCE) (United States of America)",En route (ENR),En route ,ENR,Fatalities: 47 / Occupants: 47,Fatalities: 5 / Occupants: 5,Fatalities: 52 / Occupants: 52,47,5,52,47,5,52,0,0,,47,Damaged beyond repair,Friday 24 October 1947,NC37510,United Air Lines,"Flight 608 departed Los Angeles at 10:23 for a non-stop flight to Chicago. The airplane climbed to 19,000 feet and proceeded VFR over Fontana, Daggett and Silver Lake, Las Vegas, and Saint George. At 12:21 Flight 608 reported that a fire had been detected in the baggage compartment which the crew was unable to extinguish. The report added that the cabin was filled with smoke and that the flight was attempting to make an emergency landing at Bryce Canyon Airport (BCE). The fire had erupted in the center section in the vicinity of the right wing fillet. Small parts of the airplane were lost in flight and at least one of the emergency landing flares which are located at the trailing edge of the right wing fillet ignited in flight. Shortly thereafter the flight again reported that the ""tail is going out-we may get down and we may not."" At 12:26 another transmission was received fromthe flight indicating that it was going into the ""best place available."" One minute later the flight reported ""we may make it-approaching a strip."" This was the last contact with the flight. It crashed at 12:29 before it was able to reach the airport.After the accident, investigators noted that the DC-6 airplane design included a No.3 alternate fuel tank vent outlet that was located on the right side of the fuselage near the leading edge of the wing and close to the bottom wing fillet. Approximately 10 feet aft of this point and slightly to the left there was an air scoop which served as a source of cabin heater combustion air and cooling air for the cabin supercharger air after-cooler and cabin supercharger oil cooler. Flight tests conducted with other model DC-6 aircraft subsequent to the accident revealed that overflow from the No. 3 alternate tank through the air vent line and out the vent outlet would sweep back in the slip stream toward the cabin heater combustion air intake scoop and that a considerable quantity of fuel would enter the scoop. Ground tests clearly demonstrated that, under conditions simulating the entry of fuel overflow into the scoop inflight while the heater was operating, the cabin heater could be expected to backfire and thereby propagate flame downstream into the air scoop. Incoming fuel would, thereafter, be expected to continue to burn in the air scoop and duct."
3675,3676,3,0,8/2/1947,1940,1947,4,1280,0,Avro 691 Lancastrian 3,Avro,691 Lancastrian 1,Preliminary,International Scheduled Passenger,"Buenos Aires (unknown airport), BA, Argentina","Aeroparque Internacional Jorge Newbery (AEP), Av. Costanera Rafael Obligado s/n, C1425 CABA, Argentina",-34.5580305,-58.4170088,Argentina,"Santiago-Los Cerrillos Airport (ULC/SCTI), Chile","Los Cerrillos, Cerrillos, Región Metropolitana, Chile",-33.4954605,-70.6940137,Indonesia,Argentina,,,Tupungato Mountain (Argentina),En route (ENR),En route ,ENR,Fatalities: 6 / Occupants: 6,Fatalities: 5 / Occupants: 5,Fatalities: 11 / Occupants: 11,6,5,11,6,5,11,0,0,,6,Damaged beyond repair,Saturday 2 August 1947,G-AGWH,British South American Airways - BSAA,"Went missing over the Andes mountains while on a flight to Buenos Aires. Climbers found the wreckage January 2000 at over 5,000 meters above sea-level on top of Argentina's Tupungato Mountain, close to the Chilean border."
254,255,2,0,2/9/1937,1930,1937,4,1913,1936,Douglas DC-3A-197,Douglas,DC-3A-197,Final,Domestic Scheduled Passenger,"Burbank-Union Air Terminal (BUR/KBUR), United States of America","Bob Hope Airport (BUR), 2627 N Hollywood Way, Burbank, CA 91505, USA",34.1983122,-118.3574036,United States of America,"San Francisco Municipal Airport, CA (SFO/KSFO), United States of America","San Francisco International Airport (SFO), San Francisco, CA 94128, USA",37.6213129,-122.3789554,United States of America,United States of America,,,"3 km (1.9 mls) off San Francisco Municipal Airport, CA (SFO) (United States of America)",Approach (APR),Approach ,APR,Fatalities: 9 / Occupants: 9,Fatalities: 2 / Occupants: 2,Fatalities: 11 / Occupants: 11,9,2,11,9,2,11,0,0,,9,Damaged beyond repair,Tuesday 9 February 1937,NC16073,United Air Lines,"Crashed into San Francisco Bay while on approach. The co-pilot dropped his microphone which jammed the controls, preventing the pilot from pulling out of the glide. Nine passengers and two crew died."
152,153,1,0,3/28/1933,1930,1933,4,AW.363,1928,Armstrong Whitworth Argosy II,Armstrong,Whitworth Argosy II,0,International Scheduled Passenger,"Brussel-Haren Airport, Belgium","Brussels Airport (BRU), Leopoldlaan, 1930 Zaventem, Belgium",50.900999,4.4855744,Belgium,"London-Croydon Airport (-/-), United Kingdom","Airport House, Purley Way, Croydon CR0 0XZ, UK",51.3565427,-0.1176014,United Kingdom,Belgium,,,near Diksmuide (Belgium),En route (ENR),En route ,ENR,Fatalities: 12 / Occupants: 12,Fatalities: 3 / Occupants: 3,Fatalities: 15 / Occupants: 15,12,3,15,12,3,15,0,0,,12,Destroyed,Tuesday 28 March 1933,G-AACI,Imperial Airways,"Aircraft, named ""City of Liverpool"" crashed after in-flight fire. After the fire started, the pilot tried to make an emergency landing. As it descended from 2000ft, it was seen trailing smoke from the tail section, at about 200ft it broke in two and crashed. The precise cause of the fire could not established. The investigators narrowed the cause down to the firing of some combustible substance, either accidentally by a passenger or crew member or through vibration or some other natural occurrence, or deliberately by bombing.It was thought that a fire in the lavatory of plane was caused by passenger Dr. Albert Voss, a dentist from Manchester, who supposedly attempted to commit suicide. He jumped from the plane before it crashed."
